commit,n_certified,n_certified_tiny,n_wrong,geo_mean_time,mean_regret,mean_test_auc,status,model_name,description
,11,60,0,0.287,0.00010,0.8424,keep,exact_v1,"v35 incumbent; certificate by enumerating every support of size k (k <= 4), pruned by the saturated-entropy bound, with every integer point vector enumerated on the survivors"
,42,60,0,4.419,0.00005,0.8417,keep,x2_bnb,"v35 incumbent; certificate: numba DFS over all supports of size k with incremental cells, saturated bound, rigorous continuous-LR gap bound, then exact integer B&B per support (prefix fixed, rest relaxed; sign/gcd symmetry); separation + exact column reduction"
,45,60,0,3.127,0.00005,0.8417,keep,x4_family,"v35 incumbent; certificate: numba DFS over all supports of size k with incremental cells, saturated bound, rigorous continuous-LR gap bound, then exact integer B&B per support (prefix fixed, rest relaxed; sign/gcd symmetry); separation + exact column reduction"
,48,60,0,2.044,0.00005,0.8417,keep,x5_bits,"v35 incumbent; certificate: numba DFS over all supports of size k with incremental cells, saturated bound, rigorous continuous-LR gap bound, then exact integer B&B per support (prefix fixed, rest relaxed; sign/gcd symmetry); separation + exact column reduction"
,49,60,0,1.962,0.00005,0.8417,keep,x6_adapt,"v35 incumbent; certificate: numba DFS over all supports of size k with incremental cells, saturated bound, rigorous continuous-LR gap bound, then exact integer B&B per support (prefix fixed, rest relaxed; sign/gcd symmetry); separation + exact column reduction"
,48,60,0,0.743,0.00009,0.8424,discard,x7_giveup,"v35 incumbent; certificate: numba DFS over all supports of size k with incremental cells, saturated bound, rigorous continuous-LR gap bound, then exact integer B&B per support (prefix fixed, rest relaxed; sign/gcd symmetry); separation + exact column reduction"
,49,60,0,0.760,0.00009,0.8423,keep,x7b_giveup,"v35 incumbent; certificate: numba DFS over all supports of size k with incremental cells, saturated bound, rigorous continuous-LR gap bound, then exact integer B&B per support (prefix fixed, rest relaxed; sign/gcd symmetry); separation + exact column reduction"
,49,60,0,0.743,0.00009,0.8423,discard,x8_merge,"v35 incumbent; certificate: numba DFS over all supports of size k with incremental cells, saturated bound, rigorous continuous-LR gap bound, then exact integer B&B per support (prefix fixed, rest relaxed; sign/gcd symmetry); separation + exact column reduction"
