commit,mean_regret,geo_mean_time,mean_test_auc,mean_loss,n_invalid,n_killed,n_over_limit,integer,status,model_name,description
,0.00181,2.156,0.8483,0.34282,0,0,0,true,baseline,fasterrisk,"FasterRisk 0.1.10 (Liu et al. 2022), default settings: beam search, diverse pool, star-ray rounding"
,0.07385,0.164,0.7945,0.41485,0,0,0,true,baseline,rounded_lr,"L1 logistic regression tuned to k features, refit, scaled to a largest point of 5, rounded"
,0.01669,0.344,0.8400,0.35769,0,0,0,true,baseline,abess_seqround,"abess best-subset logistic (sizes 1..k), FasterRisk's star-ray sequential rounding"
,0.01403,0.183,0.8444,0.35504,0,0,0,true,baseline,fastsparse_seqround,"fastSparse L0L2 logistic path (support <= k, box [-5,5]), star-ray sequential rounding"
,0.06261,0.382,0.8234,0.40362,0,0,0,true,baseline,autoscore,"AutoScore (Xie et al. 2020) on binary features: RF ranking, LR, coefficients / smallest, rounded"
,0.00141,1.203,0.8497,0.34241,0,0,0,false,baseline,continuous_beam,"reference, real-valued: FasterRisk's k-sparse beam search before rounding"
,0.00019,0.068,0.8496,0.34119,0,0,0,true,eval,v35_scratch,runs/sep26-run2/slim_lib/v35_scratch.py
,0.00019,0.067,0.8496,0.34119,0,0,0,true,,fine_v1,v35_scratch unchanged (the shipped FastRiskScore solver) on the fine suite: every numeric column split at its 99 percentiles
,-0.00091,0.050,0.8482,0.34010,0,0,0,true,discard,g3_pervar,"g2 + beam children: the 10 best variables by gradient, each at its best threshold (one child per variable) instead of the 10 best columns, which are mostly neighbouring thresholds of one variable"
,-0.00096,0.053,0.8486,0.34004,0,0,0,true,discard,g4_screen,"g3 + beam children screened by a 2-D fit (intercept + new point), full refit of the best 2 x beam; one colsum for swap screens; parent design reused in child fits"
,-0.00096,0.051,0.8486,0.34004,0,0,0,true,discard,g5_pervar_fast,"g2 + one beam child per variable (its best threshold by gradient, picked in numba); children screened by a 2-D fit, full refit of the best 2 x beam; per-variable loops only over rows with a nonzero code"
,0.00019,0.045,0.8496,0.34119,0,0,0,true,keep,g2_chains,"fine_v1 on a chain representation: nested binary columns detected from the data, one ordinal code per chain, all column statistics from per-code histograms (same search)"
,-0.00096,0.043,0.8486,0.34004,0,0,0,true,keep,g6_fastdata,"g2 + one beam child per variable (its best threshold by gradient, picked in numba); children screened by a 2-D fit, full refit of the best 2 x beam; nonzero-code rows only; vectorised column scan, chain codes by binary search on bitsets"
,-0.00098,0.038,0.8480,0.34003,0,0,0,true,keep,g8_newtonscreen,"g6 with the beam's child screening replaced: every column's gain for every parent is bounded by one Newton step on the new coefficient (gradient and curvature histograms, one pass per level); each parent proposes its 10 best variables at their best column; only the best 2 x beam proposals are fitted"
,-0.00118,0.040,0.8484,0.33982,0,0,0,true,keep,g10_sigdiv,g8 + beam diversity by variable signature: among proposals and among fitted children at most one per multiset of variables (supports that differ only in their thresholds count once)
,-0.00118,0.035,0.8484,0.33982,0,0,0,true,discard,g13_lean,"g12 with the swap screen returning only the picked columns (no dense (columns x values) arrays), and variable signatures built incrementally from the parent's, only for the proposals that are fitted"
,-0.00118,0.032,0.8484,0.33982,0,0,0,true,discard,g19_leaner,"g13 + ILS starts deduplicated by their score vector (duplicate columns), swap screen by partial selection, move-evaluation buffers sized per variable kind (same search)"
,-0.00118,0.034,0.8484,0.33982,0,0,0,true,keep,g12_fastils,"g10 with the beam's row weights and Newton gains in numba (x^2 block skipped for binary data), and the ILS swap phase's removal states and second-order screen in numba (same search)"
,-0.00138,0.036,0.8483,0.33963,0,0,0,true,discard,g25_pairs,"g24 + pair moves at every ILS local optimum: two support points change by one each, evaluated exactly on rows grouped by (x_S, y); accepted moves continue the local search"
,-0.00118,0.032,0.8484,0.33982,0,0,0,true,keep,g24_fastcol,"g19 + chain columns as comparisons, scores in numba, chain codes by a branchless binary search on per-word bits, new beam coefficients warm-started at the Newton step (same search)"
,-0.00083,0.089,0.8507,0.34018,0,0,0,true,keep,h2_minsup,"g24 + minimum support: every indicator column needs >= sqrt(N) weighted training rows on each side, and two thresholds of one variable in a support must be >= sqrt(N) rows apart (beam and ILS)"
,-0.00083,0.031,0.8507,0.34018,0,0,0,true,keep,h3_fastforbid,h2 with the min-support mask in numba and the ILS value-change candidates picked in one vectorised pass (same search)
,-0.00083,0.047,0.8507,0.34018,0,0,0,true,keep,h4_nbils,"h3 with the ILS iteration in numba kernels: value changes + additions, the swap phase (removal states, second-order screen, estimates for all removals) and the exact check (same search)"
,-0.00107,0.033,0.8509,0.33993,0,0,0,true,discard,h5_pairkicks,"h4 + pair kicks: after the starts, drop the pair of support columns with the cheapest combined removal and run the ILS again (next pair after a fail, 3 fails); ILS additions screened to 16 columns by a second-order model; beam: sigmoids per row group, Newton tol 1e-4, 15 exact child fits per level; swap phase keeps its removal states"
,-0.00102,0.033,0.8510,0.33998,0,0,0,true,discard,h6_kick2,"h4 + 2 pair kicks: after the starts, drop the pair of support columns with the cheapest combined removal and rerun the ILS (swap phases only within 0.1% of the best loss; next pair after a fail); ILS additions screened to 16 columns; beam: sigmoids per row group, Newton tol 1e-4, 15 exact child fits per level; swap phase keeps its removal states"
,-0.00103,0.026,0.8511,0.33997,0,0,0,true,keep,h7_kickexact,"h4 + 2 pair kicks (drop the pair of support columns whose joint removal costs least, exactly; rerun the ILS with swap phases only within 0.1% of the best; next pair after a fail) + ILS additions screened to 16 columns; whole ILS run in one numba kernel; beam: sigmoids per row group, Newton tol 1e-4, 15 exact child fits per level"
,-0.00102,0.023,0.8510,0.33998,0,0,0,true,keep,h8_fastbeam,"h7 with the beam proposals (per-variable picks, support hashes, signature cut) and the row regrouping of kept children in numba, the kick pair ranking in numba, and the rounding calibrated on distinct score values (same search up to rounding ties)"
,-0.00107,0.024,0.8515,0.33994,0,0,0,true,discard,h9_noband,h8 without the band rule: only the indicator support rule (>= sqrt(N) weighted rows on each side of every indicator); thresholds of one variable may be close
