commit,mean_regret,geo_mean_time,mean_test_auc,mean_loss,n_invalid,n_killed,n_over_limit,integer,status,model_name,description
,0.00448,1.494,0.8406,0.36029,0,0,0,true,baseline,fasterrisk,"FasterRisk 0.1.10 (Liu et al. 2022), default settings: beam search, diverse pool, star-ray rounding"
,0.08132,49.338,0.7673,0.43714,0,0,62,true,baseline,slim_milp,"SLIM (Ustun & Rudin 2016), 0-1 loss MILP solved by HiGHS within the time limit"
,0.05380,0.068,0.8119,0.40961,0,0,0,true,baseline,rounded_lr,"L1 logistic regression tuned to k features, refit, scaled to a largest point of 5, rounded"
,0.07015,0.258,0.7892,0.42597,0,0,0,true,baseline,imodels_slim,"imodels 3.0.2 SLIMClassifier without a MIP solver (rounded L2 logistic), penalty searched to k"
,0.00155,0.867,0.8444,0.35737,0,0,0,false,baseline,continuous_beam,"reference, real-valued: FasterRisk's k-sparse beam search before rounding"
,0.09654,13.629,0.7179,0.45235,0,25,32,true,baseline,riskslim,"RiskSLIM lattice cutting planes (Ustun & Rudin 2019), CPLEX 22.1 Community Edition, time limit"
,0.00448,1.444,0.8406,0.36029,0,0,0,true,keep,pyfasterrisk_v1,"FasterRisk flattened into one file: beam search, diverse pool, star-ray search with sequential rounding"
,0.00067,1.677,0.8423,0.35648,0,0,0,true,discard,v2_latticels,"FasterRisk + calibrated-loss lattice local search (coord moves, 2nd-order screened swaps/adds) from top 3 rounded pool solutions"
,0.00338,0.279,0.8415,0.35920,0,0,0,true,keep,v3_fastnewton,"FasterRisk on unique (x,y) rows with counts, numba kernels, Newton fine-tuning on the support"
,0.00061,0.450,0.8427,0.35643,0,0,0,true,discard,v4_fast_lattice,"v3 + calibrated-loss lattice local search (exact coord moves, 2nd-order screened swaps/adds) from the 3 best rounded pool solutions"
,0.00342,0.211,0.8424,0.35924,0,0,0,true,keep,v5_tunetop,v3 + beam search fine-tunes only the 2*parent_size children with the best one-coordinate loss; contiguous support block in Newton
,0.00342,0.176,0.8424,0.35924,0,0,0,true,keep,v6_numbaray,v5 + star-ray search and sequential rounding in one numba kernel; v3 + beam search fine-tunes only the 2*parent_size children with the best one-coordinate loss; contiguous support block in Newton
,0.00073,0.226,0.8429,0.35654,0,0,0,true,discard,v7_histlattice,v6 + calibrated-loss lattice local search (score histograms when X is integer) from the 3 best rounded candidates by calibrated loss; v5 + star-ray search and sequential rounding in one numba kernel; v3 + beam search fine-tunes only the 2*parent_size children with the best one-coordinate loss; contiguous support block in Newton
,0.00116,0.204,0.8419,0.35698,0,0,0,true,discard,v8_screenall,"v6 + lattice search: all moves (coord, add, swap) screened by a 2nd-order model with a,b re-fit, 8 best calibrated exactly (histograms for integer X), best-improvement; 3 starts; v5 + star-ray search and sequential rounding in one numba kernel; v3 + beam search fine-tunes only the 2*parent_size children with the best one-coordinate loss; contiguous support block in Newton"
,0.00079,0.163,0.8427,0.35661,0,0,0,true,keep,v9_pool10,v7 with the star-ray pool cut from 50 to 10 solutions and the lattice reusing the compressed rows; v6 + calibrated-loss lattice local search (score histograms when X is integer) from the 3 best rounded candidates by calibrated loss; v5 + star-ray search and sequential rounding in one numba kernel; v3 + beam search fine-tunes only the 2*parent_size children with the best one-coordinate loss; contiguous support block in Newton
,0.00068,0.178,0.8428,0.35650,0,0,0,true,discard,v10_pairmoves,v9 + joint +-1 moves on two support coordinates when single moves and swaps fail; v7 with the star-ray pool cut from 50 to 10 solutions and the lattice reusing the compressed rows; v6 + calibrated-loss lattice local search (score histograms when X is integer) from the 3 best rounded candidates by calibrated loss; v5 + star-ray search and sequential rounding in one numba kernel; v3 + beam search fine-tunes only the 2*parent_size children with the best one-coordinate loss; contiguous support block in Newton
,0.00079,0.143,0.8427,0.35661,0,0,0,true,keep,v11_pooltune,v9 + diverse pool fine-tunes only the 2*select_top_m swaps with the best one-coordinate fit; v7 with the star-ray pool cut from 50 to 10 solutions and the lattice reusing the compressed rows; v6 + calibrated-loss lattice local search (score histograms when X is integer) from the 3 best rounded candidates by calibrated loss; v5 + star-ray search and sequential rounding in one numba kernel; v3 + beam search fine-tunes only the 2*parent_size children with the best one-coordinate loss; contiguous support block in Newton
,0.00087,0.136,0.8427,0.35668,0,0,0,true,discard,v12_quickcalib,"v11 + moves ranked by 2 warm Newton steps on (a,b) (an achievable loss), chosen move fully re-calibrated; v9 + diverse pool fine-tunes only the 2*select_top_m swaps with the best one-coordinate fit; v7 with the star-ray pool cut from 50 to 10 solutions and the lattice reusing the compressed rows; v6 + calibrated-loss lattice local search (score histograms when X is integer) from the 3 best rounded candidates by calibrated loss; v5 + star-ray search and sequential rounding in one numba kernel; v3 + beam search fine-tunes only the 2*parent_size children with the best one-coordinate loss; contiguous support block in Newton"
,0.00070,0.172,0.8429,0.35652,0,0,0,true,discard,v13_zerostart,v11 + one extra lattice search started from w=0 (a forward path on the lattice); v9 + diverse pool fine-tunes only the 2*select_top_m swaps with the best one-coordinate fit; v7 with the star-ray pool cut from 50 to 10 solutions and the lattice reusing the compressed rows; v6 + calibrated-loss lattice local search (score histograms when X is integer) from the 3 best rounded candidates by calibrated loss; v5 + star-ray search and sequential rounding in one numba kernel; v3 + beam search fine-tunes only the 2*parent_size children with the best one-coordinate loss; contiguous support block in Newton
,0.00050,0.142,0.8426,0.35631,0,0,0,true,keep,v24_child5,"v23 with beam child_size 5; v22 + pair moves (joint +-1 on two support points) in the polish stage after rescale fails; v19 + Newton fine-tune stops at 1e-6 relative + non-integer data: value scans ranked by 2 warm Newton steps, best one calibrated fully; v18 + calibration Newton with one fused pass (loss, grad, Hessian) per trial point; v17 + rescale polish of the best lattice result (round t*w, t in 0.5..2, coordinate descent, accept if better); v11 + lattice value scans on per-group score histograms (rows grouped by the feature value, shift and merge per value); v9 + diverse pool fine-tunes only the 2*select_top_m swaps with the best one-coordinate fit; v7 with the star-ray pool cut from 50 to 10 solutions and the lattice reusing the compressed rows; v6 + calibrated-loss lattice local search (score histograms when X is integer) from the 3 best rounded candidates by calibrated loss; v5 + star-ray search and sequential rounding in one numba kernel; v3 + beam search fine-tunes only the 2*parent_size children with the best one-coordinate loss; contiguous support block in Newton"
,0.00051,0.122,0.8425,0.35632,0,0,0,true,keep,v27_cheap1d,"v24 + 1-D Newton ranking fits capped at 3 steps, 20 pool attempts per support feature + lattice searches stop on reaching a state visited by an earlier search in the same fit; v23 with beam child_size 5; v22 + pair moves (joint +-1 on two support points) in the polish stage after rescale fails; v19 + Newton fine-tune stops at 1e-6 relative + non-integer data: value scans ranked by 2 warm Newton steps, best one calibrated fully; v18 + calibration Newton with one fused pass (loss, grad, Hessian) per trial point; v17 + rescale polish of the best lattice result (round t*w, t in 0.5..2, coordinate descent, accept if better); v11 + lattice value scans on per-group score histograms (rows grouped by the feature value, shift and merge per value); v9 + diverse pool fine-tunes only the 2*select_top_m swaps with the best one-coordinate fit; v7 with the star-ray pool cut from 50 to 10 solutions and the lattice reusing the compressed rows; v6 + calibrated-loss lattice local search (score histograms when X is integer) from the 3 best rounded candidates by calibrated loss; v5 + star-ray search and sequential rounding in one numba kernel; v3 + beam search fine-tunes only the 2*parent_size children with the best one-coordinate loss; contiguous support block in Newton"
,0.00050,0.105,0.8425,0.35632,0,0,0,true,keep,v28_ray5,"FasterRisk-style beam (10x5, Newton fine-tune) + pool + star-ray on compressed rows (numba), star-ray with 5 multipliers, then calibrated-loss lattice search (value scans, screened swaps/adds) from 3 starts, rescale/pair polish of the best"
,0.00054,0.087,0.8427,0.35636,0,0,0,true,keep,v29_tune1,"FasterRisk-style beam (10x5, Newton fine-tune) + pool + star-ray on compressed rows (numba), star-ray with 5 multipliers, then calibrated-loss lattice search (value scans, screened swaps/adds) from 3 starts, rescale/pair polish of the best"
,0.00057,0.081,0.8428,0.35639,0,0,0,true,discard,v32_nbsupport,"FasterRisk-style beam (10x5, Newton fine-tune) + pool + star-ray on compressed rows (numba), star-ray with 5 multipliers, then calibrated-loss lattice search (value scans, screened swaps/adds) from 3 starts, rescale/pair polish of the best"
,0.00058,0.074,0.8431,0.35640,0,0,0,true,keep,v34_2starts,"FasterRisk-style beam (10x5, Newton fine-tune) + pool + star-ray on compressed rows (numba), star-ray with 5 multipliers, then calibrated-loss lattice search (value scans, screened swaps/adds) from 2 starts, rescale/pair polish of the best"
,0.00058,0.071,0.8431,0.35640,0,0,0,true,discard,v36_robust,"FasterRisk-style beam (10x5, Newton fine-tune) + pool + star-ray on compressed rows (numba), star-ray with 5 multipliers, then calibrated-loss lattice search (value scans, screened swaps/adds) from 2 starts, rescale/pair polish of the best"
