commit,mean_regret,geo_mean_time,mean_test_auc,mean_loss,n_invalid,n_killed,n_over_limit,integer,status,model_name,description
,0.00181,2.156,0.8483,0.34282,0,0,0,true,baseline,fasterrisk,"FasterRisk 0.1.10 (Liu et al. 2022), default settings: beam search, diverse pool, star-ray rounding"
,0.07385,0.164,0.7945,0.41485,0,0,0,true,baseline,rounded_lr,"L1 logistic regression tuned to k features, refit, scaled to a largest point of 5, rounded"
,0.01669,0.344,0.8400,0.35769,0,0,0,true,baseline,abess_seqround,"abess best-subset logistic (sizes 1..k), FasterRisk's star-ray sequential rounding"
,0.01403,0.183,0.8444,0.35504,0,0,0,true,baseline,fastsparse_seqround,"fastSparse L0L2 logistic path (support <= k, box [-5,5]), star-ray sequential rounding"
,0.06261,0.382,0.8234,0.40362,0,0,0,true,baseline,autoscore,"AutoScore (Xie et al. 2020) on binary features: RF ranking, LR, coefficients / smallest, rounded"
,0.00141,1.203,0.8497,0.34241,0,0,0,false,baseline,continuous_beam,"reference, real-valued: FasterRisk's k-sparse beam search before rounding"
,0.00019,0.068,0.8496,0.34119,0,0,0,true,eval,v35_scratch,runs/sep26-run2/slim_lib/v35_scratch.py
,0.00019,0.067,0.8496,0.34119,0,0,0,true,,fine_v1,v35_scratch unchanged (the shipped FastRiskScore solver) on the fine suite: every numeric column split at its 99 percentiles
,-0.00091,0.050,0.8482,0.34010,0,0,0,true,discard,g3_pervar,"g2 + beam children: the 10 best variables by gradient, each at its best threshold (one child per variable) instead of the 10 best columns, which are mostly neighbouring thresholds of one variable"
,-0.00096,0.053,0.8486,0.34004,0,0,0,true,discard,g4_screen,"g3 + beam children screened by a 2-D fit (intercept + new point), full refit of the best 2 x beam; one colsum for swap screens; parent design reused in child fits"
,-0.00096,0.051,0.8486,0.34004,0,0,0,true,discard,g5_pervar_fast,"g2 + one beam child per variable (its best threshold by gradient, picked in numba); children screened by a 2-D fit, full refit of the best 2 x beam; per-variable loops only over rows with a nonzero code"
,0.00019,0.045,0.8496,0.34119,0,0,0,true,keep,g2_chains,"fine_v1 on a chain representation: nested binary columns detected from the data, one ordinal code per chain, all column statistics from per-code histograms (same search)"
,-0.00096,0.043,0.8486,0.34004,0,0,0,true,keep,g6_fastdata,"g2 + one beam child per variable (its best threshold by gradient, picked in numba); children screened by a 2-D fit, full refit of the best 2 x beam; nonzero-code rows only; vectorised column scan, chain codes by binary search on bitsets"
,-0.00098,0.038,0.8480,0.34003,0,0,0,true,keep,g8_newtonscreen,"g6 with the beam's child screening replaced: every column's gain for every parent is bounded by one Newton step on the new coefficient (gradient and curvature histograms, one pass per level); each parent proposes its 10 best variables at their best column; only the best 2 x beam proposals are fitted"
,-0.00118,0.040,0.8484,0.33982,0,0,0,true,keep,g10_sigdiv,g8 + beam diversity by variable signature: among proposals and among fitted children at most one per multiset of variables (supports that differ only in their thresholds count once)
,-0.00118,0.035,0.8484,0.33982,0,0,0,true,discard,g13_lean,"g12 with the swap screen returning only the picked columns (no dense (columns x values) arrays), and variable signatures built incrementally from the parent's, only for the proposals that are fitted"
,-0.00118,0.032,0.8484,0.33982,0,0,0,true,discard,g19_leaner,"g13 + ILS starts deduplicated by their score vector (duplicate columns), swap screen by partial selection, move-evaluation buffers sized per variable kind (same search)"
,-0.00118,0.034,0.8484,0.33982,0,0,0,true,keep,g12_fastils,"g10 with the beam's row weights and Newton gains in numba (x^2 block skipped for binary data), and the ILS swap phase's removal states and second-order screen in numba (same search)"
,-0.00138,0.036,0.8483,0.33963,0,0,0,true,discard,g25_pairs,"g24 + pair moves at every ILS local optimum: two support points change by one each, evaluated exactly on rows grouped by (x_S, y); accepted moves continue the local search"
,-0.00118,0.032,0.8484,0.33982,0,0,0,true,keep,g24_fastcol,"g19 + chain columns as comparisons, scores in numba, chain codes by a branchless binary search on per-word bits, new beam coefficients warm-started at the Newton step (same search)"
,-0.00083,0.089,0.8507,0.34018,0,0,0,true,keep,h2_minsup,"g24 + minimum support: every indicator column needs >= sqrt(N) weighted training rows on each side, and two thresholds of one variable in a support must be >= sqrt(N) rows apart (beam and ILS)"
,-0.00083,0.031,0.8507,0.34018,0,0,0,true,keep,h3_fastforbid,h2 with the min-support mask in numba and the ILS value-change candidates picked in one vectorised pass (same search)
,-0.00083,0.047,0.8507,0.34018,0,0,0,true,keep,h4_nbils,"h3 with the ILS iteration in numba kernels: value changes + additions, the swap phase (removal states, second-order screen, estimates for all removals) and the exact check (same search)"
,-0.00107,0.033,0.8509,0.33993,0,0,0,true,discard,h5_pairkicks,"h4 + pair kicks: after the starts, drop the pair of support columns with the cheapest combined removal and run the ILS again (next pair after a fail, 3 fails); ILS additions screened to 16 columns by a second-order model; beam: sigmoids per row group, Newton tol 1e-4, 15 exact child fits per level; swap phase keeps its removal states"
,-0.00102,0.033,0.8510,0.33998,0,0,0,true,discard,h6_kick2,"h4 + 2 pair kicks: after the starts, drop the pair of support columns with the cheapest combined removal and rerun the ILS (swap phases only within 0.1% of the best loss; next pair after a fail); ILS additions screened to 16 columns; beam: sigmoids per row group, Newton tol 1e-4, 15 exact child fits per level; swap phase keeps its removal states"
,-0.00103,0.026,0.8511,0.33997,0,0,0,true,keep,h7_kickexact,"h4 + 2 pair kicks (drop the pair of support columns whose joint removal costs least, exactly; rerun the ILS with swap phases only within 0.1% of the best; next pair after a fail) + ILS additions screened to 16 columns; whole ILS run in one numba kernel; beam: sigmoids per row group, Newton tol 1e-4, 15 exact child fits per level"
,-0.00102,0.023,0.8510,0.33998,0,0,0,true,keep,h8_fastbeam,"h7 with the beam proposals (per-variable picks, support hashes, signature cut) and the row regrouping of kept children in numba, the kick pair ranking in numba, and the rounding calibrated on distinct score values (same search up to rounding ties)"
,-0.00107,0.024,0.8515,0.33994,0,0,0,true,discard,h9_noband,h8 without the band rule: only the indicator support rule (>= sqrt(N) weighted rows on each side of every indicator); thresholds of one variable may be close
,-0.00106,0.034,0.8506,0.33995,0,0,0,true,discard,i2_swapfirst,"h8 with a first-improvement swap phase: removals in order of their loss at fixed (a, b), each with its own removal state, screen and exact checks; stops at the first removal with an improving swap"
,-0.00102,0.025,0.8510,0.33998,0,0,0,true,discard,i3_fused,"h8 with fused kernels (same points): removal states, kick pair losses and exact move checks from rows keyed by (score bin, x values) in one pass; loss terms at (a, b) tabulated over integer scores in the move estimate; screen minimum in closed form; chain codes from level differences (de Bruijn bit scan); row hash and beam row weights in numba"
,-0.00103,0.026,0.8505,0.33998,0,0,0,true,keep,i4_slides,"i3 + Cholesky solves in the beam fits + threshold slides before the swap phase: at a local optimum of value changes and additions, every support threshold moves up to 8 levels along its chain with the same points, estimated from one (bin, code) histogram per column; the best 2 per column checked exactly; the full swap phase only when no slide improves"
,-0.00103,0.019,0.8505,0.33998,0,0,0,true,keep,i5_nbbeam,"i4 with each beam level in one numba kernel (parents as arrays, row groups concatenated), the rounding of all final nodes in one kernel, the ILS start state in one kernel, and the exp of each loss term reused for the next sigmoid in the Newton fits and calibrations (same points up to calibration rounding: 2 of 70 differ)"
,-0.00109,0.018,0.8507,0.33992,0,0,0,true,discard,i6_r16noband,i5 with slides up to 16 levels and without the band rule (only the indicator support rule: >= sqrt(N) weighted rows on each side of every indicator)
,-0.00103,0.017,0.8505,0.33998,0,0,0,true,discard,i7_supphist,"i5 with the support columns' (bin, code) histograms built in one pass over the rows per ILS iteration and shared by the value changes and the slides; column scan with popcount counts (same points)"
,-0.00103,0.017,0.8505,0.33998,0,0,0,true,discard,i8_uint8,"i7 + chain codes stored as uint8 when every variable has at most 256 codes (less memory traffic in every row pass), removal states in two row passes, slides with the integer-score table (same points)"
,-0.00103,0.018,0.8504,0.33997,0,0,0,true,discard,i9_escape,"i8 + one escape per ILS run: at the first local optimum the best swap by the estimate is applied although it does not improve, the descent continues, and the run returns its best point"
,-0.00107,0.016,0.8506,0.33993,0,0,0,true,discard,i10_rswap,"i8 + kicks replaced by refit swaps (the 4 best swaps by the estimate at the best point, each with a continuous refit of its support and a calibrated rounding; local search from the best rounding), the beam's final pool cut to the 5 nodes the starts use (same 15 exact fits at the last level), additions screened to 8 columns, slides up to 16 levels, no band rule (indicator support rule only)"
,-0.00107,0.016,0.8506,0.33993,0,0,0,true,discard,i11_rswap8,"i10 with slides up to 8 levels (without the band rule, 16 levels give the same points on 69 of 70 problems)"
,-0.00107,0.015,0.8506,0.33993,0,0,0,true,keep,i12_rswapc,i11 with the refit swaps reusing the candidates of the failing swap phase at the best point (kept from its local search run) instead of recomputing them (same points)
,-0.00110,0.016,0.8506,0.33991,0,0,0,true,discard,i13_rsf2,i12 with the refit swaps repeated from the best point until two fail (each candidate rounding tried once); the beam's binary children materialised in one row pass
,-0.00107,0.017,0.8506,0.33993,0,0,0,true,discard,i14_alloc,"i12 with fewer fixed costs per fit (same points): pseudo-random hash vectors as import-time prefixes of the seeded streams instead of new generators, typed dicts made inside numba, one work allocation per move estimate, Newton fits and calibrations without per-iteration allocations (calibration on bins without the 2m-row copies), child-fit buffers reused, binary beam children materialised in one pass"
,-0.00110,0.014,0.8507,0.33991,0,0,0,true,discard,i15_kick1,"i14 + one pair kick after the refit swaps (drop the support pair whose joint removal costs least, local search again; stop at the first fail)"
,-0.00107,0.014,0.8506,0.33993,0,0,0,true,keep,i16_fixed,"i14 + the refit swaps' local search runs swap phases only within 0.1% of the best loss (same points), byte code matrix built directly when every column is binary, reused counting buffers in the rounding (same points)"
,-0.00107,0.013,0.8506,0.33993,0,0,0,true,discard,i17_chkfirst,"i16 + exact checks stop at the first improving candidate in estimate order, and after a main-phase move the other checked value changes are tried exactly on the new point before a new main phase"
,-0.00100,0.013,0.8505,0.34001,0,0,0,true,discard,i18_scur,i17 with the swap screen of every removal taken from the derivatives at the current point (one colsum of 2 columns) instead of at each removal state
,-0.00107,0.013,0.8506,0.33993,0,0,0,true,discard,i19_radix,"i17 + rows made unique by a radix sort of their hash (same order as numpy's stable sort), beam levels after the first in one kernel when they surely fit in the time left (same points)"
,-0.00109,0.014,0.8505,0.33992,0,0,0,true,discard,i20_scalek,"i19 + a rescale move at the end: the best points times 0.75 / 1.5 / 2 (rounded, clipped to [-5, 5]); a local search from the rescaled point with the smallest calibrated loss"
,-0.00104,0.011,0.8507,0.33997,0,0,0,true,keep,i21_spat2,"i19 + patience on the starts: after the third start, stop when the last two starts did not improve the best point (the starts are taken in order of their rounded loss)"
,-0.00106,0.013,0.8508,0.33994,0,0,0,true,discard,i22_spatkick,"i21 + one pair kick after the refit swap (drop the support pair whose joint removal costs least, local search with swap phases only within 0.1% of the best; stop at the first fail)"
,-0.00104,0.015,0.8507,0.33997,0,0,0,true,discard,i23_spatrsf2,i21 with the refit swaps repeated from the best point until two fail
,-0.00104,0.013,0.8507,0.33997,0,0,0,true,discard,i24_clean,"i21 cleaned: dead code paths removed (pair kicks, pair moves, re-rounding, screen at the current point, Python rounding and helpers), docstring updated (same points)"
,-0.00104,0.012,0.8507,0.33997,0,0,0,true,discard,i25_spatall,i24 with the start patience from the first start on (stop whenever two starts in a row do not improve the best; the third-start minimum never changed a point)
,-0.00105,0.011,0.8506,0.33996,0,0,0,true,discard,i26_last4,"i25 with 20 exact fits at the beam's last level (LASTSCREEN 4 for the pool of 5), ufunc.at calls in the data setup replaced"
,-0.00091,0.011,0.8507,0.34009,0,0,0,true,discard,i27_sec2,i26 + the second best rounding (over the scale grid) of the best rounded beam node as one more start
,-0.00105,0.010,0.8506,0.33996,0,0,0,true,discard,i28_speps,i26 + start patience counts an improvement of less than 0.1% of the best loss as a fail; data setup skips the 0/1 check of the value table when every column is a chain (same points otherwise)
,-0.00104,0.011,0.8505,0.33996,0,0,0,true,discard,i29_light,"i28 with the refit swap's local search running swap phases only when it is at or below the best loss, slides up to 6 levels, additions screened to 6 columns"
,-0.00104,0.011,0.8505,0.33996,0,0,0,true,discard,i30_final,i29 with the support histograms' suffix sums only down to the lowest level a move reads (same points); the final configuration of this run
,-0.00104,0.011,0.8505,0.33996,0,0,0,true,discard,i31_rsruns2,i30 with local searches from the two best refit-swap roundings instead of one
