commit,mean_regret,geo_mean_time,mean_test_auc,mean_loss,n_invalid,n_killed,n_over_limit,integer,status,model_name,description
,0.00448,1.494,0.8406,0.36029,0,0,0,true,baseline,fasterrisk,"FasterRisk 0.1.10 (Liu et al. 2022), default settings: beam search, diverse pool, star-ray rounding"
,0.08132,49.338,0.7673,0.43714,0,0,62,true,baseline,slim_milp,"SLIM (Ustun & Rudin 2016), 0-1 loss MILP solved by HiGHS within the time limit"
,0.05380,0.068,0.8119,0.40961,0,0,0,true,baseline,rounded_lr,"L1 logistic regression tuned to k features, refit, scaled to a largest point of 5, rounded"
,0.07015,0.258,0.7892,0.42597,0,0,0,true,baseline,imodels_slim,"imodels 3.0.2 SLIMClassifier without a MIP solver (rounded L2 logistic), penalty searched to k"
,0.00155,0.867,0.8444,0.35737,0,0,0,false,baseline,continuous_beam,"reference, real-valued: FasterRisk's k-sparse beam search before rounding"
,0.09654,13.629,0.7179,0.45235,0,25,32,true,baseline,riskslim,"RiskSLIM lattice cutting planes (Ustun & Rudin 2019), CPLEX 22.1 Community Edition, time limit"
,0.00448,1.469,0.8406,0.36029,0,0,0,true,keep,pyfasterrisk_v1,"FasterRisk flattened into one file: beam search, diverse pool, star-ray search with sequential rounding"
,0.00399,0.296,0.8414,0.35981,0,0,0,true,keep,v2_numba,"FasterRisk ported to numba on unique (x, y) rows with sparse columns: beam search, diverse pool, star-ray sequential rounding; final pick by calibrated loss"
,0.00073,0.540,0.8415,0.35654,0,0,0,true,discard,v3_ils,"FasterRisk ported to numba on unique (x, y) rows with sparse columns: beam search, diverse pool, star-ray sequential rounding; final pick by calibrated loss"
,0.00073,0.367,0.8415,0.35654,0,0,0,true,discard,v4_binned,"FasterRisk ported to numba on unique (x, y) rows with sparse columns: beam search, diverse pool, star-ray sequential rounding; final pick by calibrated loss"
,0.00055,0.264,0.8427,0.35637,0,0,0,true,keep,v5_nopool,"FasterRisk ported to numba on unique (x, y) rows with sparse columns: beam search, diverse pool, star-ray sequential rounding; final pick by calibrated loss"
,0.00157,0.195,0.8415,0.35739,0,0,0,true,discard,v6_screen,"FasterRisk ported to numba on unique (x, y) rows with sparse columns: beam search, diverse pool, star-ray sequential rounding; final pick by calibrated loss"
,0.00056,0.107,0.8427,0.35637,0,0,0,true,keep,v7_groups,"FasterRisk ported to numba on unique (x, y) rows with sparse columns: beam search, diverse pool, star-ray sequential rounding; final pick by calibrated loss"
,0.00062,0.104,0.8428,0.35643,0,0,0,true,discard,v8_rawscreen,"FasterRisk ported to numba on unique (x, y) rows with sparse columns: beam search, diverse pool, star-ray sequential rounding; final pick by calibrated loss"
,0.00049,0.165,0.8428,0.35631,0,0,0,true,discard,v9_starts10,"FasterRisk ported to numba on unique (x, y) rows with sparse columns: beam search, diverse pool, star-ray sequential rounding; final pick by calibrated loss"
,0.00055,0.103,0.8427,0.35637,0,0,0,true,discard,v10_fastdata,"FasterRisk ported to numba on unique (x, y) rows with sparse columns: beam search, diverse pool, star-ray sequential rounding; final pick by calibrated loss"
,0.00057,0.098,0.8428,0.35639,0,0,0,true,discard,v11_swapscreen,"FasterRisk ported to numba on unique (x, y) rows with sparse columns: beam search, diverse pool, star-ray sequential rounding; final pick by calibrated loss"
,0.00057,0.099,0.8428,0.35639,0,0,0,true,discard,v12_countbins,"FasterRisk ported to numba on unique (x, y) rows with sparse columns: beam search, diverse pool, star-ray sequential rounding; final pick by calibrated loss"
,0.00057,0.071,0.8428,0.35639,0,0,0,true,keep,v14_numbachild,"FasterRisk ported to numba on unique (x, y) rows with sparse columns: beam search, diverse pool, star-ray sequential rounding; final pick by calibrated loss"
,0.00040,0.063,0.8427,0.35622,0,0,0,true,keep,v16_swaplast,"FasterRisk ported to numba on unique (x, y) rows with sparse columns: beam search, diverse pool, star-ray sequential rounding; final pick by calibrated loss"
,0.00020,0.066,0.8430,0.35602,0,0,0,true,keep,v17_calround,"FasterRisk ported to numba on unique (x, y) rows with sparse columns: beam search, diverse pool, star-ray sequential rounding; final pick by calibrated loss"
,0.00016,0.057,0.8430,0.35597,0,0,0,true,keep,v18_roundnb,"FasterRisk ported to numba on unique (x, y) rows with sparse columns: beam search, diverse pool, star-ray sequential rounding; final pick by calibrated loss"
,0.00010,0.056,0.8428,0.35592,0,0,0,true,discard,v21_hybrid,"FasterRisk ported to numba on unique (x, y) rows with sparse columns: beam search, diverse pool, star-ray sequential rounding; final pick by calibrated loss"
,0.00010,0.049,0.8428,0.35592,0,0,0,true,keep,v24_blasscreen,"FasterRisk ported to numba on unique (x, y) rows with sparse columns: beam search, diverse pool, star-ray sequential rounding; final pick by calibrated loss"
,0.00010,0.051,0.8428,0.35592,0,0,0,true,discard,v25_blasgrad,"FasterRisk ported to numba on unique (x, y) rows with sparse columns: beam search, diverse pool, star-ray sequential rounding; final pick by calibrated loss"
,0.00010,0.046,0.8428,0.35592,0,0,0,true,discard,v27,"FasterRisk ported to numba on unique (x, y) rows with sparse columns: beam search, diverse pool, star-ray sequential rounding; final pick by calibrated loss"
,0.00010,0.042,0.8428,0.35592,0,0,0,true,keep,v30_lazycodes,"FasterRisk ported to numba on unique (x, y) rows with sparse columns: beam search, diverse pool, star-ray sequential rounding; final pick by calibrated loss"
,0.00010,0.044,0.8428,0.35592,0,0,0,true,discard,v31_batchchild,"numba beam search on grouped rows, calibrated-loss rounding, integer local search with cell-level calibrated move estimates; children fitted per parent in one numba call"
,0.00010,0.042,0.8428,0.35592,0,0,0,true,discard,v32_valdeltas,"numba beam search on grouped rows, calibrated-loss rounding, integer local search with cell-level calibrated move estimates; children fitted per parent in one numba call"
,0.00010,0.040,0.8424,0.35592,0,0,0,true,discard,v33_estskip,"numba beam search on grouped rows, calibrated-loss rounding, integer local search with cell-level calibrated move estimates; children fitted per parent in one numba call"
,0.00010,0.037,0.8424,0.35592,0,0,0,true,keep,v34_gemm,"numba beam search on grouped rows, calibrated-loss rounding, integer local search with cell-level calibrated move estimates; children fitted per parent in one numba call"
,0.00010,0.038,0.8424,0.35592,0,0,0,true,discard,v35_scratch,"numba beam search on grouped rows, calibrated-loss rounding, integer local search with cell-level calibrated move estimates; children fitted per parent in one numba call"
