commit,mean_regret,geo_mean_time,mean_test_auc,mean_loss,n_invalid,n_killed,n_over_limit,integer,status,model_name,description
,-0.00121,0.019,0.8506,0.33980,0,0,0,true,discard,k7_beam2,"k1 + a second beam (5 parents, 5 children) with the most important variable of the best point (largest exact removal loss) forbidden; local search from its 2 best roundings (2 fails)"
,-0.00125,0.014,0.8507,0.33976,0,0,0,true,discard,k8_tabuwalk,"k1 + tabu walk after the refit swaps: 3 forced best-estimate swaps (removed columns may not return, added columns may not leave), local search with the removed columns forbidden, then a full local search"
,-0.00124,0.013,0.8508,0.33976,0,0,0,true,discard,k9_shake,"k1 + shakes after the refit swaps: every support point moved by a deterministic pseudo-random -1/0/+1, 4 shakes, local search from the best (2 fails)"
,-0.00123,0.016,0.8509,0.33977,0,0,0,true,discard,k10_pairkickrf,"k1 + pair-drop kicks with a refit after the refit swaps: drop the 2 pairs of support columns with the smallest exact joint removal loss, continuous refit + rounding of the rest, local search re-adds"
,-0.00132,0.018,0.8507,0.33969,0,0,0,true,discard,k11_pairs,"k1 + pair moves after the refit swaps: the 12 best swaps by the estimate and every +-1 value change, every compatible pair of them scored by exact calibrated loss; local search from the best pair"
,-0.00126,0.013,0.8507,0.33974,0,0,0,true,discard,k12_pairs8,k11 with pairs only among the 8 single moves of lowest exact loss
,-0.00132,0.015,0.8507,0.33969,0,0,0,true,discard,k13_pairsgate,k11 only when the best point has a calibrated logit range >= 10 (the polish gate)
,-0.00109,0.011,0.8512,0.33991,0,0,0,true,discard,k14_spat1,k1 with start patience 1 (stop after the first start that does not improve the best)
,-0.00108,0.012,0.8512,0.33993,0,0,0,true,discard,k15_spat1ls3,k14 + LASTSCREEN 3 (15 exact fits at the last beam level)
,-0.00109,0.013,0.8512,0.33992,0,0,0,true,discard,k16_spat1rnm10,k14 + start roundings on 10 scales instead of 20
,-0.00116,0.012,0.8509,0.33985,0,0,0,true,discard,k17_pol1,k1 with one polish round instead of 3
,-0.00127,0.019,0.8507,0.33973,0,0,0,true,discard,k18_pairsafter,k11 moved after the polish (monotone: the final point of k1 is the incumbent; polish again only after an improvement)
,-0.00127,0.016,0.8507,0.33974,0,0,0,true,discard,k19_pairsaftg,k18 gated to logit range >= 10
,-0.00127,0.019,0.8505,0.33973,0,0,0,true,discard,k20_vtabuafter,"k5 (variable-tabu restarts, 4 variables) moved after the polish (monotone)"
,-0.00125,0.020,0.8506,0.33975,0,0,0,true,discard,k21_beam2after,k7 (second beam with the top variable forbidden) moved after the polish (monotone)
,-0.00130,0.024,0.8505,0.33971,0,0,0,true,discard,k22_pairsvtabu,"k18 followed by k20: pairs, then variable-tabu restarts, both after the polish (monotone)"
,-0.00126,0.045,0.8512,0.33975,0,0,0,true,discard,k23_long,"long-search reference: final pool 20, 20 starts, no start patience, refit swaps until 3 fail, pair moves (2 fails)"
,-0.00108,0.012,0.8505,0.33993,0,0,0,true,discard,k24_pool10,k1 with a final beam pool of 10 (starts = the 5 best calibrated roundings of 10 supports)
,-0.00125,0.013,0.8507,0.33976,0,0,0,true,discard,k25_sortrows,k1 with the unique rows in input order (sequential gathers) instead of hash order
,-0.00110,0.013,0.8511,0.33990,0,0,0,true,discard,k26_spat1pairs,k15 + gated pair moves after the polish (k19)
,-0.00125,0.012,0.8510,0.33976,0,0,0,true,discard,k27_speps3,k1 with start patience counting improvements below 0.3% as fails (SPEPS 0.003)
,-0.00099,0.010,0.8513,0.34002,0,0,0,true,discard,k28_spat1ls3pol1,k15 + one polish round
,-0.00127,0.013,0.8507,0.33974,0,0,0,true,discard,k29_pairsaftg6,k19 with 6 swaps instead of 12 in the pair set (cheaper gated monotone pair moves after the polish)
,-0.00125,0.012,0.8507,0.33976,0,0,0,true,discard,k30_final,"k1 (same points) with the oct04-fine6 probe knobs present but off (XMODE 1-8, XAFTER, XKM1, RFTOL/RFM/RNM, SORTU) and the docstring updated; the final file of this run"
